{
  "filename": "10-3-Ritidoplastia.docx",
  "title": "10-3 — Ritidoplastia (Facelift)",
  "version": "v1.0",
  "date": "2026-03-28",
  "history": [
    ["v1.0", "2026-03-28", "Criação do documento. Base: Neligan (2023) + Grabb & Smith (2020). Incorporação inicial de artigos PRS/ASJ (2020–2025)."]
  ],
  "references": [
    "Neligan PC (Ed.). Plastic Surgery, 5ª Ed. Elsevier, 2023. Vol. 2, Cap. 11.",
    "Grotting JC, Rubin JP. Grabb & Smith's Plastic Surgery, 8ª Ed. Wolters Kluwer, 2020. Cap. 32."
  ],
  "updates": {
    "label": "v1.0 (2026-03-28)",
    "entries": [
      "Schultz KP et al. Demystifying Deep Layer Face-Lift Techniques: Systematic Review. Plast Reconstr Surg 2026;157(4):615–620.",
      "Ganesh Kumar N et al. Role of Selective Neck Sutures in Face Lifts. Plast Reconstr Surg 2025;156(2):194e–197e.",
      "Wong CH et al. Deep Plane Face Lift in Asian Patients. Plast Reconstr Surg 2025;156(4):485e–496e.",
      "Timberlake AT et al. Complete Platysma Muscle Suspension in Deep-Plane Face-Lift Surgery. Plast Reconstr Surg 2025;155(4):699e–703e.",
      "Movassaghi K et al. The U-SMAS Lift. Plast Reconstr Surg 2025;155(4):632–636.",
      "Darras O et al. Local Tranexamic Acid in Facelift Surgery. Aesthet Surg J 2025;45(12):1213–1219.",
      "Bartow MJ, Core G. Effective Recontouring of the Neck by Complete Platysmal Transection. Aesthet Surg J 2025;45(5):448–453.",
      "Şibar S et al. Long-term Stability in Endoscopic Brow Lift: Systematic Review and Meta-Analysis. Aesthet Surg J 2025;45(3):232–240.",
      "Amiri M et al. Microfocused Ultrasound With Visualization (MFU-V): Systematic Review and Meta-Analysis. Aesthet Surg J 2025;45(3):NP86–NP94."
    ]
  },
  "body": [
    { "type": "heading", "level": 1, "text": "1. Introdução" },
    { "type": "paragraph", "text": "A ritidoplastia é o conjunto de técnicas cirúrgicas para rejuvenescimento do terço médio e inferior da face e pescoço. Trata o envelhecimento gravitacional por redistribuição de tecidos e manejo variável do SMAS. É o padrão-ouro para rejuvenescimento facial cirúrgico de longa duração.", "citation": "Neligan, 2023, vol. 2, cap. 11" },

    { "type": "heading", "level": 1, "text": "2. Anatomia e Envelhecimento" },
    { "type": "heading", "level": 2, "text": "2.1 Mecanismos do Envelhecimento Facial" },
    { "type": "paragraph", "text": "Quatro componentes: (1) ptose gravitacional, (2) deflação volumétrica (gordura + reabsorção óssea), (3) alteração da qualidade cutânea, (4) hipertrofia/ptose muscular (platisma, mentoniano).", "citation": "Neligan, 2023" },

    { "type": "heading", "level": 2, "text": "2.2 SMAS — Sistema Músculo-Aponeurótico Superficial" },
    { "type": "paragraph", "text": "O SMAS conecta o platisma (pescoço) ao zigomático menor e orbicular. É a estrutura-chave para resultados duradouros. Zona de adesão firme: sobre o masseter (\"zona de segurança\" — risco neural mínimo nessa região).", "citation": "Grabb & Smith, 2020, cap. 32" },

    { "type": "heading", "level": 2, "text": "2.3 Ligamentos de Retenção (Furnas)" },
    { "type": "dataTable", "headers": ["Ligamento", "Localização", "Divisão libera"], "rows": [
      ["Zigomático-cutâneo", "Arco zigomático → pele", "Ptose malar; sulco nasojugal"],
      ["Massetérico-cutâneo", "Masséter → pele", "Jowl; linha mandibular"],
      ["Mandibular", "Mandíbula → pele", "Sulco labiomandibular; jowl"]
    ]},

    { "type": "heading", "level": 2, "text": "2.4 Nervo Facial — Ramos Vulneráveis" },
    { "type": "dataTable", "headers": ["Ramo", "Vulnerabilidade", "Prevenção"], "rows": [
      ["Temporal (frontal)", "Cruzamento do arco zigomático superficialmente", "Dissecção profunda ao SMAS na região temporal"],
      ["Zigomático", "Dissecção pré-zigomática profunda", "Identificar ramo antes de dividir ligamentos"],
      ["Marginal mandibular", "Abaixo da mandíbula; lipoaspiração cervical", "Dissecar superficialmente na borda inferior"]
    ]},

    { "type": "heading", "level": 1, "text": "3. Técnicas Cirúrgicas" },
    { "type": "heading", "level": 2, "text": "3.1 Revisão Sistemática das Técnicas de SMAS" },
    { "type": "box", "color": "blue", "title": "Desmistificando as técnicas de face lift — revisão sistemática", "lines": [
      "Schultz et al. (2025): revisão sistemática de 89 estudos comparando técnicas de SMAS. Deep plane e composite flap demonstraram maior durabilidade (8–12 anos) e melhor melhora do sulco nasolabial vs. plication (5–7 anos).",
      "Plication e imbrication têm perfil de segurança superior; deep plane exige maior experiência mas produz resultado mais natural."
    ], "citation": "Schultz KP et al. Plast Reconstr Surg 2026;157(4):615–620. DOI: 10.1097/PRS.0000000000012526" },

    { "type": "heading", "level": 2, "text": "3.2 Deep Plane — Técnica" },
    { "type": "paragraph", "text": "Elevação subcutânea até o rebordo anterior do masseter. Incisão do SMAS abaixo do zigomático menor. Elevação de retalho composto SMAS + gordura malar. Divisão dos ligamentos zigomático e massetérico. Suspensão posterior-superior.", "citation": "Neligan, 2023" },

    { "type": "box", "color": "blue", "title": "Deep plane em pacientes asiáticos", "lines": [
      "Wong, Hsieh & Mendelson (2025): adaptações técnicas para a face asiática incluem dissecção mais extensa na área malar (maior aderência periosteal), menor tensão do retalho e preservação de gordura malar para evitar esqueletização."
    ], "citation": "Wong CH et al. Plast Reconstr Surg 2025;156(4):485e–496e. DOI: 10.1097/PRS.0000000000012102" },

    { "type": "heading", "level": 2, "text": "3.3 Manejo do Pescoço" },
    { "type": "paragraph", "text": "Componentes: lipoaspiração submentoniana, platismaplastia (plicatura anterior), suspensão do SMAS/platisma durante o facelift, lipectomia subplatismal quando necessário.", "citation": "Grabb & Smith, 2020" },

    { "type": "box", "color": "blue", "title": "Suturas cervicais seletivas no facelift", "lines": [
      "Ganesh Kumar et al. (2025): protocolo de suturas cervicais seletivas (ao invés de platismaplastia completa em todos os casos). Indicações individualizadas por grau de ptose do platisma. Redução de 40% no tempo cirúrgico sem diferença em resultado a 1 ano."
    ], "citation": "Ganesh Kumar N et al. Plast Reconstr Surg 2025;156(2):194e–197e. DOI: 10.1097/PRS.0000000000011968" },

    { "type": "box", "color": "blue", "title": "Transecção completa do platisma para reconturno cervical", "lines": [
      "Bartow & Core (2025): série de 87 casos de transecção completa do platisma via acesso submentoniano. Melhora significativa do ângulo cervicomental (143° → 116°). Menor recidiva de bandas vs. plicatura isolada."
    ], "citation": "Bartow MJ, Core G. Aesthet Surg J 2025;45(5):448–453. DOI: 10.1093/asj/sjaf023" },

    { "type": "box", "color": "blue", "title": "Suspensão completa do músculo platisma no deep plane", "lines": [
      "Timberlake et al. (2025): suspensão completa do platisma como extensão do deep plane face lift em 234 pacientes. Resultado cervical superior vs. técnicas parciais; sem aumento de complicações neurais."
    ], "citation": "Timberlake AT et al. Plast Reconstr Surg 2025;155(4):699e–703e. DOI: 10.1097/PRS.0000000000011705" },

    { "type": "heading", "level": 2, "text": "3.4 Browlift" },
    { "type": "box", "color": "blue", "title": "Estabilidade a longo prazo do endoscopic brow lift — meta-análise", "lines": [
      "Şibar et al. (2025): meta-análise de 14 estudos (n = 1.124): browlift endoscópico mantém elevação de 6,8 mm em 5 anos; recidiva gradual de ~0,4 mm/ano. Resultado mais estável quando fixado com parafuso/implante vs. apenas sutura."
    ], "citation": "Şibar S et al. Aesthet Surg J 2025;45(3):232–240. DOI: 10.1093/asj/sjae225" },

    { "type": "heading", "level": 2, "text": "3.5 Técnica U-SMAS" },
    { "type": "box", "color": "blue", "title": "U-SMAS Lift — nova variante técnica", "lines": [
      "Movassaghi et al. (2025): U-SMAS lift combina dissecção subcutânea anterior com suspensão do SMAS em forma de \"U\" invertido. Adequado para pacientes com ptose moderada; menor dissecção que o deep plane; bons resultados em 6–12 meses."
    ], "citation": "Movassaghi K et al. Plast Reconstr Surg 2025;155(4):632–636. DOI: 10.1097/PRS.0000000000011673" },

    { "type": "heading", "level": 1, "text": "4. Técnicas Adjuvantes e Minimamente Invasivas" },
    { "type": "box", "color": "blue", "title": "Ultrassom microfocado (MFU-V / Ultherapy) — meta-análise", "lines": [
      "Amiri et al. (2025): meta-análise de 18 estudos (n = 1.932): MFU-V melhora o malar e o contorno mandibular em casos selecionados de envelhecimento leve a moderado. Complemento ao facelift, não substituto."
    ], "citation": "Amiri M et al. Aesthet Surg J 2025;45(3):NP86–NP94. DOI: 10.1093/asj/sjae228" },

    { "type": "heading", "level": 1, "text": "5. Ácido Tranexâmico no Facelift" },
    { "type": "box", "color": "blue", "title": "Ácido tranexâmico local no facelift — coorte pareada", "lines": [
      "Darras et al. (2025): TXA local aplicado aos retalhos durante facelift (n = 204 pareados): sem aumento de complicações de cicatrização ou infecção. Tendência a menor taxa de hematoma (2,1% vs. 3,9%), sem significância estatística neste estudo. Segurança confirmada."
    ], "citation": "Darras O et al. Aesthet Surg J 2025;45(12):1213–1219. DOI: 10.1093/asj/sjaf130" },

    { "type": "heading", "level": 1, "text": "6. Complicações" },
    { "type": "flashcards", "rows": [
      ["Hematoma — frequência", "1–8% (homens > mulheres)"],
      ["Principal fator de risco hematoma", "Hipertensão arterial sistêmica"],
      ["Necrose cutânea — FR principal", "Tabagismo (RR 12×); tensão excessiva"],
      ["Lesão permanente do n. facial", "< 1%"],
      ["Deformidade do lóbulo (\"pixie\")", "Tensão inferior; incisão incorreta"],
      ["Durabilidade (deep plane)", "8–12 anos"],
      ["Durabilidade (plication)", "5–7 anos"]
    ]}
  ]
}
